{
  "case_id": "CASE-004",
  "version": "0.1",
  "description": "数码产品知乎软文，固定费，要求真实使用体验、字数1200+，未写修改规则与审核方式",
  "source": "synthetic",
  "raw_task": "知乎好物任务：某国产降噪耳机『静界 Pro』，图文回答形式，需真实使用场景与听感描述，字数1200字以上，插入商品链接，纯软文不标广告；稿费300元，7日内完成，稿费到账时间以知乎提现规则为准。",
  "expected_adtask": {
    "task_id": "TASK-NB-20260918-004",
    "source": { "platform": "知乎", "source_url": null, "captured_at": null },
    "brand": { "name": "静界", "product": "静界 Pro 降噪耳机", "category": "数码" },
    "campaign": {
      "objective": "知乎好物带货",
      "target_audience": null,
      "content_type": "图文回答",
      "key_messages": ["真实使用场景与听感描述"],
      "mandatory_points": ["字数1200字以上", "插入商品链接", "纯软文不标广告"],
      "forbidden_points": []
    },
    "commercial": { "creator_fee": 300, "commission": null, "bonus": null, "estimated_total_income": 300, "settlement_rule": "稿费到账时间以知乎提现规则为准" },
    "production": {
      "deadline": null,
      "estimated_hours": null,
      "content_format": "图文回答",
      "word_count": 1200,
      "image_count": null,
      "video_required": false,
      "special_requirements": []
    },
    "requirements": {
      "platform_rules": [],
      "brand_review": null,
      "revision_limit": null,
      "approval_required": null
    },
    "risk": {}
  },
  "expected_evidence": [
    { "evidence_id": "EVD-20260918-0012", "type": "task_fact", "source": { "origin": "raw_task" }, "content": "稿费300元", "reliability": 0.98 },
    { "evidence_id": "EVD-20260918-0013", "type": "task_fact", "source": { "origin": "raw_task" }, "content": "字数1200字以上", "reliability": 0.98 },
    { "evidence_id": "EVD-20260918-0014", "type": "task_fact", "source": { "origin": "raw_task" }, "content": "截止时间为相对表述'7日内完成'，具体日期取决于接单日", "reliability": 0.9 },
    { "evidence_id": "EVD-20260918-0015", "type": "task_fact", "source": { "origin": "raw_task" }, "content": "修改次数与审核方式未写明", "reliability": 0.98 }
  ],
  "account_profile": null,
  "expected_decision": null,
  "actual_outcome": null
}