{
  "case_id": "CASE-007",
  "version": "0.1",
  "description": "母婴品牌直播预告宣发，时间敏感，需固定文案要点与直播时间露出",
  "source": "synthetic",
  "raw_task": "某母婴品牌直播预告宣发招募小红书博主：合作形式为图文预告，需露出直播时间（9月22日20:00）、直播福利关键词『半价尿裤』与直播间入口链接；不可使用今晚等模糊时间描述；费用60元；发布后2小时内不可删除。",
  "expected_adtask": {
    "task_id": "TASK-NB-20260918-007",
    "source": { "platform": "newbang", "source_url": null, "captured_at": null },
    "brand": { "name": "某母婴品牌", "product": null, "category": "母婴" },
    "campaign": {
      "objective": "直播预告宣发",
      "target_audience": null,
      "content_type": "图文",
      "key_messages": ["直播时间9月22日20:00", "半价尿裤"],
      "mandatory_points": ["露出直播时间", "露出直播福利关键词", "含直播间入口链接"],
      "forbidden_points": ["不可使用'今晚'等模糊时间描述"]
    },
    "commercial": { "creator_fee": 60, "commission": null, "bonus": null, "estimated_total_income": 60, "settlement_rule": null },
    "production": {
      "deadline": "2026-09-22T20:00:00Z",
      "estimated_hours": null,
      "content_format": "图文",
      "word_count": null,
      "image_count": null,
      "video_required": false,
      "special_requirements": ["发布后2小时内不可删除"]
    },
    "requirements": {
      "platform_rules": [],
      "brand_review": null,
      "revision_limit": null,
      "approval_required": null
    },
    "risk": {}
  },
  "expected_evidence": [
    { "evidence_id": "EVD-20260918-0023", "type": "task_fact", "source": { "origin": "raw_task" }, "content": "费用60元", "reliability": 0.98 },
    { "evidence_id": "EVD-20260918-0024", "type": "task_fact", "source": { "origin": "raw_task" }, "content": "直播时间为9月22日20:00（截至发布内容需在此之前完成）", "reliability": 0.98 },
    { "evidence_id": "EVD-20260918-0025", "type": "task_fact", "source": { "origin": "raw_task" }, "content": "修改次数未写明", "reliability": 0.98 }
  ],
  "account_profile": null,
  "expected_decision": null,
  "actual_outcome": null
}