{
  "case_id": "CASE-019",
  "version": "0.1",
  "description": "高客单宠物粮任务：图文/视频二选一、寄样+稿费、需宠物出镜",
  "source": "synthetic",
  "raw_task": "高端宠物粮『鲜本』招募小红书博主：主粮1.5kg寄样（价值约350元）+稿费200元；图文或视频任选其一（图文≥400字含喂食对比，视频20秒以上含宠物体态展示）；需宠物自然出镜；禁止宣称'治疗/治疗皮肤病'等医疗功效；发布后笔记保留4个月；需添加官方链接。",
  "expected_adtask": {
    "task_id": "TASK-NB-20260918-019",
    "source": { "platform": "newbang", "source_url": null, "captured_at": null },
    "brand": { "name": "鲜本", "product": "主粮1.5kg", "category": "宠物" },
    "campaign": {
      "objective": "种草带货",
      "target_audience": null,
      "content_type": "图文或视频",
      "key_messages": [],
      "mandatory_points": ["需宠物自然出镜", "需添加官方链接", "笔记保留4个月"],
      "forbidden_points": ["禁止医疗功效宣称"]
    },
    "commercial": { "creator_fee": 200, "commission": null, "bonus": null, "estimated_total_income": 550, "settlement_rule": "寄样主粮价值约350元+稿费200元" },
    "production": {
      "deadline": null,
      "estimated_hours": null,
      "content_format": "图文或视频",
      "word_count": 400,
      "image_count": null,
      "video_required": false,
      "special_requirements": ["图文≥400字含喂食对比 或 视频20秒以上含宠物体态展示"]
    },
    "requirements": {
      "platform_rules": [],
      "brand_review": null,
      "revision_limit": null,
      "approval_required": null
    },
    "risk": { "claim_risk": "宠物粮医疗功效宣称有合规风险" }
  },
  "expected_evidence": [
    { "evidence_id": "EVD-20260918-0061", "type": "task_fact", "source": { "origin": "raw_task" }, "content": "寄样价值约350元+稿费200元，预估总收入约550元", "reliability": 0.9 },
    { "evidence_id": "EVD-20260918-0062", "type": "task_fact", "source": { "origin": "raw_task" }, "content": "图文或视频二选一", "reliability": 0.98 },
    { "evidence_id": "EVD-20260918-0063", "type": "task_fact", "source": { "origin": "raw_task" }, "content": "修改次数未写明", "reliability": 0.98 }
  ],
  "account_profile": null,
  "expected_decision": null,
  "actual_outcome": null
}