{
  "case_id": "CASE-021",
  "version": "0.1",
  "description": "真实任务（用户提供）：公众号财富类按阅读单价计费任务，CPM 形态（0.5025元/阅读），推送后48小时结算，推广期长跨度",
  "source": "user_provided",
  "raw_task": "价格高！文案温和！不伤粉！\n推广时间：2025-10-07 至 2027-05-01\n结算周期：推文后 48小时结算\n阅读单价：0.5025元\n要求：\n公众号类型：财富\n男女比例：男粉多\n阅读数门槛：不低于100\n接单频率：允许接过该广告主其他项目的公众号隔30天再接单",
  "expected_adtask": {
    "task_id": "TASK-NB-20260918-021",
    "source": { "platform": "公众号", "source_url": "https://a.newrank.cn/center/#/detail/tender?fakeId=41EF5E4C9D9848001CB68E9ED881CB36", "captured_at": null },
    "brand": { "name": "新榜项目（广告主未署名）", "product": null, "category": "财富" },
    "campaign": {
      "objective": null,
      "target_audience": "男女比例：男粉多",
      "content_type": "公众号图文",
      "key_messages": [],
      "mandatory_points": ["文案温和，不伤粉"],
      "forbidden_points": []
    },
    "commercial": {
      "creator_fee": null,
      "commission": null,
      "bonus": null,
      "estimated_total_income": null,
      "settlement_rule": "阅读单价 0.5025 元/阅读；推文后 48 小时结算（CPM 计费形态，收入=阅读数×0.5025）"
    },
    "production": {
      "deadline": "2027-05-01T00:00:00Z",
      "estimated_hours": null,
      "content_format": "公众号图文",
      "word_count": null,
      "image_count": null,
      "video_required": false,
      "special_requirements": ["推广期为 2025-10-07 至 2027-05-01，此为可接单/履行窗口"]
    },
    "requirements": {
      "platform_rules": [
        "公众号类型须为财富类",
        "男女比例：男粉多",
        "阅读数门槛：不低于 100",
        "接单频率：接过该广告主其他项目后须隔 30 天再接单"
      ],
      "brand_review": null,
      "revision_limit": null,
      "approval_required": null
    },
    "risk": {
      "account_reputation_risk": "'不伤粉'要求文案温和；财富类内容存在平台限流与敏感表述风险（依据未写明，属推断）"
    }
  },
  "expected_evidence": [
    { "evidence_id": "EVD-20260918-0068", "type": "task_fact", "source": { "origin": "raw_task", "url": "https://a.newrank.cn/center/#/detail/tender?fakeId=41EF5E4C9D9848001CB68E9ED881CB36" }, "content": "阅读单价 0.5025 元，推文后 48 小时结算（CPM 形态，无固定费）", "reliability": 0.98 },
    { "evidence_id": "EVD-20260918-0069", "type": "task_fact", "source": { "origin": "raw_task", "url": "https://a.newrank.cn/center/#/detail/tender?fakeId=41EF5E4C9D9848001CB68E9ED881CB36" }, "content": "公众号类型须为财富类、男粉多、阅读数门槛不低于100", "reliability": 0.98 },
    { "evidence_id": "EVD-20260918-0070", "type": "task_fact", "source": { "origin": "raw_task", "url": "https://a.newrank.cn/center/#/detail/tender?fakeId=41EF5E4C9D9848001CB68E9ED881CB36" }, "content": "推广期 2025-10-07 至 2027-05-01", "reliability": 0.98 },
    { "evidence_id": "EVD-20260918-0071", "type": "task_fact", "source": { "origin": "raw_task", "url": "https://a.newrank.cn/center/#/detail/tender?fakeId=41EF5E4C9D9848001CB68E9ED881CB36" }, "content": "接单频率：接过该广告主其他项目后隔30天可再接", "reliability": 0.98 },
    { "evidence_id": "EVD-20260918-0072", "type": "task_fact", "source": { "origin": "raw_task", "url": "https://a.newrank.cn/center/#/detail/tender?fakeId=41EF5E4C9D9848001CB68E9ED881CB36" }, "content": "品牌/产品/字数/图片/修改轮次/审核要求均未写明", "reliability": 0.98 }
  ],
  "account_profile": null,
  "expected_decision": null,
  "actual_outcome": null
}