{
  "case_id": "CASE-005",
  "version": "0.1",
  "description": "美妆新品抖音视频，多必选卖点、需上身/上脸拍摄，有修改次数上限",
  "source": "synthetic",
  "raw_task": "【彩妆】XX蜜粉饼抖音短视频任务：30-60秒，需上脸实测（持妆对比），口播必含『控油12小时』『隐形毛孔』两个卖点，标题带话题#XX蜜粉饼#，可挂小黄车；报价1200元，修改不超过2次；48小时内交付。",
  "expected_adtask": {
    "task_id": "TASK-NB-20260918-005",
    "source": { "platform": "抖音", "source_url": null, "captured_at": null },
    "brand": { "name": "XX", "product": "蜜粉饼", "category": "美妆" },
    "campaign": {
      "objective": "新品曝光与带货",
      "target_audience": null,
      "content_type": "短视频",
      "key_messages": ["控油12小时", "隐形毛孔"],
      "mandatory_points": ["口播必含控油12小时与隐形毛孔卖点", "上脸实测持妆对比", "带话题#XX蜜粉饼#", "可挂小黄车"],
      "forbidden_points": []
    },
    "commercial": { "creator_fee": 1200, "commission": null, "bonus": null, "estimated_total_income": 1200, "settlement_rule": null },
    "production": {
      "deadline": null,
      "estimated_hours": null,
      "content_format": "短视频",
      "word_count": null,
      "image_count": null,
      "video_required": true,
      "special_requirements": ["30-60秒", "48小时内交付"]
    },
    "requirements": {
      "platform_rules": [],
      "brand_review": null,
      "revision_limit": 2,
      "approval_required": null
    },
    "risk": {}
  },
  "expected_evidence": [
    { "evidence_id": "EVD-20260918-0016", "type": "task_fact", "source": { "origin": "raw_task" }, "content": "报价1200元", "reliability": 0.98 },
    { "evidence_id": "EVD-20260918-0017", "type": "task_fact", "source": { "origin": "raw_task" }, "content": "修改不超过2次", "reliability": 0.98 },
    { "evidence_id": "EVD-20260918-0018", "type": "task_fact", "source": { "origin": "raw_task" }, "content": "必含卖点：控油12小时、隐形毛孔", "reliability": 0.98 },
    { "evidence_id": "EVD-20260918-0019", "type": "task_fact", "source": { "origin": "raw_task" }, "content": "交付期限：48小时内（相对，以接单时刻起算）", "reliability": 0.9 }
  ],
  "account_profile": null,
  "expected_decision": null,
  "actual_outcome": null
}