{
  "case_id": "CASE-017",
  "version": "0.1",
  "description": "健身课程推广抖音：转化诉求、地区限制、虚拟产品无物流",
  "source": "synthetic",
  "raw_task": "健身App『燃动』线上训练营课程推广：抖音短视频60秒内，口播引导评论区领取30元优惠券；限发布区域：一线城市优先（测试人群）；报价300元+按转化人数5元/人；课程为虚拟商品无实物；需用官方提供的素材包（含口播脚本可选）；禁止使用'减脂必瘦''一周见效'等承诺性表述。",
  "expected_adtask": {
    "task_id": "TASK-NB-20260918-017",
    "source": { "platform": "抖音", "source_url": null, "captured_at": null },
    "brand": { "name": "燃动", "product": "线上训练营课程", "category": "健身" },
    "campaign": {
      "objective": "课程转化引流",
      "target_audience": "一线城市用户优先",
      "content_type": "短视频",
      "key_messages": [],
      "mandatory_points": ["口播引导评论区领取30元优惠券", "限发布区域：一线城市优先"],
      "forbidden_points": ["禁止'减脂必瘦''一周见效'等承诺性表述"]
    },
    "commercial": { "creator_fee": 300, "commission": null, "bonus": null, "estimated_total_income": null, "settlement_rule": "按转化人数5元/人另计" },
    "production": {
      "deadline": null,
      "estimated_hours": null,
      "content_format": "短视频",
      "word_count": null,
      "image_count": null,
      "video_required": true,
      "special_requirements": ["60秒内", "官方素材包", "虚拟商品无实物"]
    },
    "requirements": {
      "platform_rules": [],
      "brand_review": null,
      "revision_limit": null,
      "approval_required": null
    },
    "risk": { "claim_risk": "承诺性减肥表述有广告合规风险" }
  },
  "expected_evidence": [
    { "evidence_id": "EVD-20260918-0055", "type": "task_fact", "source": { "origin": "raw_task" }, "content": "报价300元+按转化人数5元/人", "reliability": 0.98 },
    { "evidence_id": "EVD-20260918-0056", "type": "task_fact", "source": { "origin": "raw_task" }, "content": "限发布区域：一线城市优先", "reliability": 0.98 },
    { "evidence_id": "EVD-20260918-0057", "type": "task_fact", "source": { "origin": "raw_task" }, "content": "修改次数未写明", "reliability": 0.98 }
  ],
  "account_profile": null,
  "expected_decision": null,
  "actual_outcome": null
}