{
  "case_id": "CASE-010",
  "version": "0.1",
  "description": "B站数码测评长视频，授权范围与发票结算，素材需开箱+数据实测",
  "source": "synthetic",
  "raw_task": "B站UP主商单：『智测』显示器测评视频，5-8分钟，需开箱、面板参数实测（色域/漏光）、游戏帧率测试三个环节；报价2000元+按播放量阶梯加成（1万播+100元，上限500元）；需提供发票；商业授权范围：站内视频授权6个月；60天内发布。",
  "expected_adtask": {
    "task_id": "TASK-NB-20260918-010",
    "source": { "platform": "B站", "source_url": null, "captured_at": null },
    "brand": { "name": "智测", "product": "显示器", "category": "数码" },
    "campaign": {
      "objective": "产品测评种草",
      "target_audience": null,
      "content_type": "视频",
      "key_messages": [],
      "mandatory_points": ["开箱环节", "面板参数实测（色域/漏光）", "游戏帧率测试"],
      "forbidden_points": []
    },
    "commercial": { "creator_fee": 2000, "commission": null, "bonus": null, "estimated_total_income": 2500, "settlement_rule": "播放量阶梯加成：1万播+100元上限500元；需发票" },
    "production": {
      "deadline": null,
      "estimated_hours": null,
      "content_format": "视频",
      "word_count": null,
      "image_count": null,
      "video_required": true,
      "special_requirements": ["5-8分钟", "60天内发布"]
    },
    "requirements": {
      "platform_rules": [],
      "brand_review": null,
      "revision_limit": null,
      "approval_required": null
    },
    "risk": { "copyright_risk": "商业授权范围：站内视频授权6个月" }
  },
  "expected_evidence": [
    { "evidence_id": "EVD-20260918-0032", "type": "task_fact", "source": { "origin": "raw_task" }, "content": "报价2000元+播放量加成（上限500元），预估总收入2500元", "reliability": 0.9 },
    { "evidence_id": "EVD-20260918-0033", "type": "task_fact", "source": { "origin": "raw_task" }, "content": "商业授权范围：站内视频授权6个月", "reliability": 0.98 },
    { "evidence_id": "EVD-20260918-0034", "type": "task_fact", "source": { "origin": "raw_task" }, "content": "修改次数与品牌审核未写明", "reliability": 0.98 }
  ],
  "account_profile": null,
  "expected_decision": null,
  "actual_outcome": null
}