{
  "case_id": "CASE-018",
  "version": "0.1",
  "description": "家电公众号贴片二条任务：字数区间、截止未写（unknown 用例）、按指数结算",
  "source": "synthetic",
  "raw_task": "家电品牌『清欢』空气净化器公众号贴片广告：推文内嵌贴片图，头条或二条均可；正文600-800字软文围绕'母婴适用'展开；报价：新榜指数700-800档50元/条；图片由品牌提供2张；截止时间未注明；抢单后3天内推送。",
  "expected_adtask": {
    "task_id": "TASK-NB-20260918-018",
    "source": { "platform": "公众号", "source_url": null, "captured_at": null },
    "brand": { "name": "清欢", "product": "空气净化器", "category": "家电" },
    "campaign": {
      "objective": "贴片广告投放",
      "target_audience": "母婴家庭",
      "content_type": "公众号图文",
      "key_messages": ["母婴适用"],
      "mandatory_points": ["头条或二条均可", "正文600-800字围绕母婴适用"],
      "forbidden_points": []
    },
    "commercial": { "creator_fee": 50, "commission": null, "bonus": null, "estimated_total_income": 50, "settlement_rule": "按新榜指数700-800档50元/条结算" },
    "production": {
      "deadline": null,
      "estimated_hours": null,
      "content_format": "公众号图文",
      "word_count": 700,
      "image_count": 2,
      "video_required": false,
      "special_requirements": ["抢单后3天内推送"]
    },
    "requirements": {
      "platform_rules": ["推送须为头条或二条"],
      "brand_review": null,
      "revision_limit": null,
      "approval_required": null
    },
    "risk": {}
  },
  "expected_evidence": [
    { "evidence_id": "EVD-20260918-0058", "type": "task_fact", "source": { "origin": "raw_task" }, "content": "报价按指数档50元/条", "reliability": 0.9 },
    { "evidence_id": "EVD-20260918-0059", "type": "task_fact", "source": { "origin": "raw_task" }, "content": "截止时间未注明（unknown），仅规定抢单后3天内推送", "reliability": 0.98 },
    { "evidence_id": "EVD-20260918-0060", "type": "task_fact", "source": { "origin": "raw_task" }, "content": "修改次数未写明", "reliability": 0.98 }
  ],
  "account_profile": null,
  "expected_decision": null,
  "actual_outcome": null
}