{
  "case_id": "CASE-008",
  "version": "0.1",
  "description": "服饰寄拍任务，以置换形式结算（无现金），需3张上身图+视频15秒，强调真实感",
  "source": "synthetic",
  "raw_task": "女装店『MOMO』寄拍合作：寄送当季新款连衣裙，发布小红书图文需3张以上上身展示图+15秒穿搭视频；款式与尺码由店铺指定；以置换形式结算（衣服归博主），无额外稿费；笔记保留3个月；风格需与店铺日系风格一致，禁过度修图。",
  "expected_adtask": {
    "task_id": "TASK-NB-20260918-008",
    "source": { "platform": "newbang", "source_url": null, "captured_at": null },
    "brand": { "name": "MOMO", "product": "当季新款连衣裙", "category": "服饰" },
    "campaign": {
      "objective": "新品穿搭展示",
      "target_audience": null,
      "content_type": "图文+视频",
      "key_messages": [],
      "mandatory_points": ["3张以上上身展示图", "15秒穿搭视频", "风格与店铺日系风格一致"],
      "forbidden_points": ["禁过度修图"]
    },
    "commercial": { "creator_fee": null, "commission": null, "bonus": null, "estimated_total_income": null, "settlement_rule": "以置换形式结算（衣服归博主），无额外稿费" },
    "production": {
      "deadline": null,
      "estimated_hours": null,
      "content_format": "图文+视频",
      "word_count": null,
      "image_count": 3,
      "video_required": true,
      "special_requirements": ["款式与尺码由店铺指定", "笔记保留3个月"]
    },
    "requirements": {
      "platform_rules": [],
      "brand_review": null,
      "revision_limit": null,
      "approval_required": null
    },
    "risk": {}
  },
  "expected_evidence": [
    { "evidence_id": "EVD-20260918-0026", "type": "task_fact", "source": { "origin": "raw_task" }, "content": "结算为实物置换，无现金报酬，需折算价值评估经济性", "reliability": 0.9 },
    { "evidence_id": "EVD-20260918-0027", "type": "task_fact", "source": { "origin": "raw_task" }, "content": "笔记保留3个月", "reliability": 0.98 },
    { "evidence_id": "EVD-20260918-0028", "type": "task_fact", "source": { "origin": "raw_task" }, "content": "修改次数与交付期限未写明", "reliability": 0.98 }
  ],
  "account_profile": null,
  "expected_decision": null,
  "actual_outcome": null
}