{
  "case_id": "CASE-001",
  "version": "0.1",
  "description": "母婴京东活动宣发，水下图文代发，低价走量，需自撰文案、笔记保留1年",
  "source": "synthetic",
  "raw_task": "某品牌母婴品活动宣发招募小红书博主。项目：母婴京东活动宣发。合作形式：水下图文（代发）。费用：50元。发布日期：7月29日。备注：给到素材，需要自己撰写文案，笔记需保留1年。达人需提供账号ID、粉丝量、赞藏量、主页链接、蒲公英链接、互动量、手机号、微信号。",
  "expected_adtask": {
    "task_id": "TASK-NB-20260918-001",
    "source": { "platform": "newbang", "source_url": null, "captured_at": null },
    "brand": { "name": "某品牌母婴", "product": null, "category": "母婴" },
    "campaign": {
      "objective": "活动宣发",
      "target_audience": null,
      "content_type": "图文",
      "key_messages": [],
      "mandatory_points": ["水下图文（代发）", "笔记需保留1年", "自撰文案"],
      "forbidden_points": []
    },
    "commercial": { "creator_fee": 50, "commission": null, "bonus": null, "estimated_total_income": 50, "settlement_rule": null },
    "production": {
      "deadline": "2026-07-29T00:00:00Z",
      "estimated_hours": null,
      "content_format": "图文",
      "word_count": null,
      "image_count": null,
      "video_required": false,
      "special_requirements": ["需要自己撰写文案", "笔记需保留1年"]
    },
    "requirements": {
      "platform_rules": [],
      "brand_review": null,
      "revision_limit": null,
      "approval_required": null
    },
    "risk": {}
  },
  "expected_evidence": [
    { "evidence_id": "EVD-20260918-0001", "type": "task_fact", "source": { "origin": "raw_task" }, "content": "合作形式：水下图文（代发）", "reliability": 0.98 },
    { "evidence_id": "EVD-20260918-0002", "type": "task_fact", "source": { "origin": "raw_task" }, "content": "费用：50元", "reliability": 0.98 },
    { "evidence_id": "EVD-20260918-0003", "type": "task_fact", "source": { "origin": "raw_task" }, "content": "笔记需保留1年", "reliability": 0.98 },
    { "evidence_id": "EVD-20260918-0004", "type": "task_fact", "source": { "origin": "raw_task" }, "content": "修改次数未写明", "reliability": 0.98 }
  ],
  "account_profile": null,
  "expected_decision": null,
  "actual_outcome": null
}