{
  "case_id": "CASE-002",
  "version": "0.1",
  "description": "护肤品牌图文种草，固定费+佣金，必须产品露出并突出'敏感肌可用'，禁止竞品比较，需品牌审核",
  "source": "synthetic",
  "raw_task": "【护肤品类】XX妍肌：限小红书图文，需真人出镜（可协商），重点突出『敏感肌可用』卖点，不得提竞品；广告费 800 元 + 佣金按链接成交 5%；截止 9月20日；需品牌审核通过后发布。",
  "expected_adtask": {
    "task_id": "TASK-NB-20260918-002",
    "source": { "platform": "小红书", "source_url": null, "captured_at": null },
    "brand": { "name": "XX妍肌", "product": null, "category": "护肤" },
    "campaign": {
      "objective": "图文种草",
      "target_audience": null,
      "content_type": "图文",
      "key_messages": ["敏感肌可用"],
      "mandatory_points": ["产品露出", "突出敏感肌可用卖点"],
      "forbidden_points": ["不得提竞品"]
    },
    "commercial": { "creator_fee": 800, "commission": 5, "bonus": null, "estimated_total_income": null, "settlement_rule": "佣金按链接成交 5%" },
    "production": {
      "deadline": "2026-09-20T00:00:00Z",
      "estimated_hours": null,
      "content_format": "图文",
      "word_count": null,
      "image_count": null,
      "video_required": false,
      "special_requirements": ["真人出镜（可协商）"]
    },
    "requirements": {
      "platform_rules": [],
      "brand_review": "需品牌审核通过后发布",
      "revision_limit": null,
      "approval_required": true
    },
    "risk": {}
  },
  "expected_evidence": [
    { "evidence_id": "EVD-20260918-0005", "type": "task_fact", "source": { "origin": "raw_task" }, "content": "广告费 800 元 + 佣金按链接成交 5%", "reliability": 0.98 },
    { "evidence_id": "EVD-20260918-0006", "type": "task_fact", "source": { "origin": "raw_task" }, "content": "禁止提及竞品", "reliability": 0.98 },
    { "evidence_id": "EVD-20260918-0007", "type": "task_fact", "source": { "origin": "raw_task" }, "content": "需品牌审核通过后发布", "reliability": 0.98 },
    { "evidence_id": "EVD-20260918-0008", "type": "task_fact", "source": { "origin": "raw_task" }, "content": "修改次数未写明", "reliability": 0.98 }
  ],
  "account_profile": null,
  "expected_decision": null,
  "actual_outcome": null
}