{
  "$schema": "../cases-case.schema.json",
  "case_id": "CASE-001",
  "version": "0.1",
  "description": "示例任务：虚构品牌护肤品的图文种草任务（用于演示 / 校验 Task Parser 规则）",
  "source": "user_provided",
  "raw_task": "【品牌方】XX护肤：限小红书图文，需真人出镜（可协商），重点突出『敏感肌可用』，不得提竞品；广告费 800 元 + 佣金按链接成交 5%；截止 9月20日；需品牌审核通过后发布。",

  "expected_adtask": {
    "task_id": "TASK-NB-YYYYMMDD-001",
    "source": {
      "platform": "newbang",
      "captured_at": "YYYY-MM-DDTHH:mm:ssZ"
    },
    "brand": {
      "name": "XX护肤",
      "product": null,
      "category": "护肤"
    },
    "campaign": {
      "objective": "图文种草",
      "target_audience": null,
      "content_type": "图文",
      "key_messages": ["敏感肌可用"],
      "mandatory_points": ["产品露出", "敏感肌可用卖点"],
      "forbidden_points": ["竞品比较"]
    },
    "commercial": {
      "creator_fee": 800,
      "commission": null,
      "bonus": null,
      "estimated_total_income": null,
      "settlement_rule": "佣金按链接成交 5%"
    },
    "production": {
      "deadline": "YYYY-MM-DDTHH:mm:ssZ",
      "estimated_hours": null,
      "content_format": "图文",
      "video_required": false,
      "special_requirements": ["真人出镜（可协商）"]
    },
    "requirements": {
      "brand_review": "需品牌审核通过后发布",
      "revision_limit": null,
      "approval_required": true
    },
    "risk": {}
  },

  "expected_evidence": [
    {
      "evidence_id": "EVD-YYYYMMDD-0001",
      "type": "task_fact",
      "source": { "origin": "raw_task" },
      "content": "广告费 800 元 + 佣金按链接成交 5%",
      "reliability": 0.98
    },
    {
      "evidence_id": "EVD-YYYYMMDD-0002",
      "type": "task_fact",
      "source": { "origin": "raw_task" },
      "content": "修改次数未写明",
      "reliability": 0.98
    }
  ],

  "account_profile": null,

  "expected_decision": null,

  "actual_outcome": null
}